ZM203R2027_157,𠊎這世人無虧欠麼儕所以先愛理得
ZM203R2027_158,吊燈得風吹到晃啊晃阿哥成下係田徑選手
ZM203R2027_159,喊佢加著一領衫出門佢偏偏毋聽人講
ZM203R2027_160,這個路口不時有車禍經過个時務愛細義
ZM203R2027_161,放尞日去做一息仔零工多少趁一兜仔所費
ZM203R2027_162,這個學者歸日起狂來研究各式各樣个問題
ZM203R2027_163,已經佢都真無閒你猶直直尋佢做麼个
ZM203R2027_164,這站係工廠無閒个時務想討請假真難
ZM203R2027_165,壁崠貼一張停水通知客事各腔聲調無共樣
ZM203R2027_166,怪奇藏到哪位去尋恁久猶尋毋會著
ZM203R2027_167,莫恁嚇人會嚇死人這個考試个筆試較難
ZM203R2027_168,蹛在遐個所在自由安樂過日像天堂共樣
ZM203R2027_169,下頜先用燒面帕揞一下正較好修嘴鬚
ZM203R2027_170,無著等个人猶有安慰獎好提猶算毋會䆀啦
ZM203R2027_171,遐個學生真認真逐禮拜去圖書館讀書
ZM203R2027_172,仰子會恁糊塗今日愛補課嗄來睡過頭
ZM203R2027_173,阿弟無著雨衫走去涿雨歸膴身涿到溼溚溚
ZM203R2027_174,這個公司早期直直了錢落尾正有趁錢
ZM203R2027_175,佢自細在外國蹛所以毋會曉講家鄉个事
ZM203R2027_176,一直喊你攏無因素想講你無聽著咧
ZM203R2027_177,毋係𫣆自家个狗無爺櫃驚會起狂咬人
ZM203R2027_178,頭下直直哼食肚枵仰子你毋先去食飯咧
ZM203R2027_179,落恁大个雨真好佳載堵著阿叔載你轉來
ZM203R2027_180,成擺用灶煮飯遐下無歕火火毋會偎
ZM203R2027_181,今日先生無拁人䀴病逐暗夜讀書讀到天光
ZM203R2027_182,對待个朋友愛用真心認證考試開始報名吂
ZM203R2027_183,收音機係二十世紀人類真偉大个一種發明
ZM203R2027_184,阿妹嫁去臺中个上頭兩年啊毋識轉外家
ZM203R2027_185,若無特殊情況社區住民大討會贊成正著
ZM203R2027_186,這寫毋著較緊改過恁久个筆記簿猶留蹛
ZM203R2027_187,大家拁書掀到下一頁桌崠个資料提得𠊎
ZM203R2027_188,病院內底有真多病人成過農民用鐮鐵割禾
ZM203R2027_189,佢做人真熱心尋佢鬥相共黏時即到位
ZM203R2027_190,去發展較落後个國家愛注意安全佮衛生
ZM203R2027_191,屋下單淨佢一儕人定𠊎得你二十秒想一下
ZM203R2027_192,請在這個格內底簽名這餅大人細子攏真愛食
ZM203R2027_193,阿弟代表班上去比賽去泅水池尋教練學泅水
ZM203R2027_194,食飽來去廳下泡茶食去店頭買一罐牛乳轉來
ZM203R2027_195,颱風拁招牌吹到街尾佢寫真多客家文學作品
ZM203R2027_196,掃把趁去愛擱買啊風忒大蠟燭火焰佢啊
ZM203R2027_197,佢過年前有來𠊎个店內底後下即無䀴著佢啊
ZM203R2027_198,這師傅智慈經驗真足講著錢即會打派感情
ZM203R2027_199,𠊎食較少兜無要緊𠊎永遠記得你个溫情
ZM203R2027_200,阿妹个作品真有特色遐個少年䀴起來真戇面
ZM203R2027_201,仰子會好定泥毋見去毋會用偷偷拁筆擎用
ZM203R2027_202,這青菜和魚愛隔開食若係毋會即莫烏白舞
ZM203R2027_203,這代表麼个你知無外頭落大雨猶鳴雷公
ZM203R2027_204,阿依个手摸起來粗粗豬腳愛若綿正咬會落
ZM203R2027_205,這藥品產生真多問題佢兩儕轉外去湖脣散步
ZM203R2027_206,發票兩個月對獎一擺半夜你仰子猶嚴睡
ZM203R2027_207,這個地區輒輒做大水這件事情暫時莫拁佢講
ZM203R2027_208,做人猶愛平心正好各人个命莫安𧊅別儕
ZM203R2027_209,著衫褲尞紙愛撓好來即招佢講愛做會用無
ZM203R2027_210,阿太毋會曉用手機你想清楚正拁𠊎講
ZM203R2027_211,櫃拖淰到關毋會起來飯煮好啊好食當晝啊
ZM203R2027_212,佢生理失敗走路啊過年去到哪位攏人尖人
ZM203R2027_213,大家愛多接觸大自然阿弟嘴䫌面上黏著盤粒
ZM203R2027_214,學校頒花感謝狀得佢大樹下係坐歇个好所在
ZM203R2027_215,你乖乖坐个莫烏白走佢偷提物件得人發現
ZM203R2027_216,年三十夜愛食團圓飯佢在這間大樓內底辦公
ZM203R2027_217,你即照實講無要緊你做你講阿爸等靠
ZM203R2027_218,水燶好啊緊去洗浴鹽講恁多毋使錢係無
ZM203R2027_219,這係假藥會食壞人這果子進口个真貴食
ZM203R2027_220,見係年節即愛拜神明人過啊跌歸泥下無人撿
ZM203R2027_221,這幾日天氣冷颱颱運動對身體有足多好處
ZM203R2027_222,𠊎真愛聽阿公講古你擱去擎莊上片來䀴
ZM203R2027_223,碰著人愛拁人回失禮毋講事即係標示無意見
ZM203R2027_224,年三十暗夜食團圓飯這個月月底係阿哥生日
ZM203R2027_225,佢在路上撿著五百銀去食麵定著愛攪辣椒醬
ZM203R2027_226,佢个客事講到十分好阿怙今日釣著十外尾魚
ZM203R2027_227,寬寬食毋好哽著哦這間餐廳食品全然高級
ZM203R2027_228,壁上个人類愛逐人車無主意碰著你真失禮
ZM203R2027_229,偎暗啊粉鳥會轉藪在屋下無事做真無心色
ZM203R2027_230,講著食哦佢著第一跳索愛注意毋好徑著
ZM203R2027_231,即像毋係佢个細孤款你後個月討去新竹係無
ZM203R2027_232,天氣敢講又討轉冷啊事情頭好係像你講个恁
ZM203R2027_233,機車車牌有四個數字這間大學分做五個學院
ZM203R2027_234,一支嘴直直唊真吵毋好在後背講人个歹事
ZM203R2027_235,佢兩儕嘛係𠊎表个去屋背捋一兩皮七層塔
ZM203R2027_236,這裡這裡个草𠊎割到差不多啊接落即交得你收尾
ZM203R2027_237,做大水遐下真得人驚你盡量食頭好食淨淨
ZM203R2027_238,佢這擺个成績無理想日頭炙屎胐好起來啊
ZM203R2027_239,丈㜷老佮阿郎就像兩子爺共樣有事情愛相參詳
ZM203R2027_240,行船一擺至少個半月先生教過个愛多溫習
ZM203R2027_241,一弓弓蕉有五六秕佢係這個委員會个委員
ZM203R2027_242,毋好恁賤愛較改兜若無才調即莫䀴愛低
ZM203R2027_243,佢真輒去人屋下白食這擺考試佢高分錄取
ZM203R2027_244,菜脯剁到幼幼正包粽麵糸忒久煮到膏膏啊
ZM203R2027_245,恁熱著襖會熱壞數學無好即愛加強練習
ZM203R2027_246,逐擺拜公媽攏跌無筊物件囥到壞去真打爽
ZM203R2027_247,這滿繳稅無像成過堅費氣有各種方法會使用
ZM203R2027_248,這擺佢人討去大陸尞阿公逐晨早去公園運動
ZM203R2027_249,這個歌星成擺真有名書面上个圖片印到真靚
ZM203R2027_250,佢个客事講到真標準這件事你个䀴花仰子
ZM203R2027_251,天討光即準備去掛紙先生教个你學會啊吂
ZM203R2027_252,提畚斗拁垃圾抔出去這樹崠个朳仔毋知熟吂
ZM203R2027_253,食齋个人用火油炒菜阿妹驚生份毋敢喊人
ZM203R2027_254,阿妹真愛攬人公子睡這個節目係麼儕主持个
ZM203R2027_255,時代無共啊這下醫療制度比成過猶擱較健全
ZM203R2027_256,你恁重麼儕背會贏阿弟踢著桌腳烏青啊
ZM203R2027_257,錢無袋好跌毋見啊門無關好問會走入去
ZM203R2027_258,這滿無閒後擺正講作垺來去䀴電影好無
ZM203R2027_259,佢逐日會去公園慢走子女愛體會爺哀个辛苦
ZM203R2027_260,新親戚和媒人共桌坐想討害人顛倒害著自家
ZM203S2027_001,毋會枵个一葩火
ZM203S2027_002,逐儕心肝底攏有一炮光光个點火𠊎有一炮點火囥在心肝頭
ZM203S2027_003,這炮跈𠊎有真多年个展風越來越光
ZM203S2027_004,小學出業遐年家鄉吂有佢種所以學校分到三二佢種
ZM203S2027_005,莊頭去山車河正有新竹客運一日來去上班
ZM203S2027_006,三車轉新基隆尾班車係討暗毋得外
ZM203S2027_007,遐時个路無恬麼个見堵著落雨
ZM203S2027_008,可比講食食烏車班即無事
ZM203S2027_009,上下課个時毋會赴著車班即愛用行路去學校抑係轉屋下
ZM203S2027_010,一臨轉頭無毛个三天外中實在有運
ZM203S2027_011,記得正開學三個外月个一日
ZM203S2027_012,因為英文課大家無認真歸班流落來補習
ZM203S2027_013,𠊎毋敢拁先生講愛赴車班
ZM203S2027_014,戇戇跈大家共下到五點下課
ZM203S2027_015,緊緊三步做兩步飛去赴昨晡
ZM203S2027_016,走到兩腳無貼地行到氣喘喘
ZM203S2027_017,到車頭个時車著即走去啊
ZM203S2027_018,人生份路無事天色越來越暗愛仰子正好
ZM203S2027_019,堵好一班去苗栗个車班煞煞上車到銅鑼盤車
ZM203S2027_020,轉到街路攏七點外天著即暗啊
ZM203S2027_021,山路彎彎斡斡無停火轉屋下个路暗争争
ZM203S2027_022,風个衫和狗吠个衫參額色陪𠊎慢慢行
ZM203S2027_023,一儕跍跍斑斑行到硬硬即討唩个時
ZM203S2027_024,遠遠䀴著一點光搖搖晃晃越來越偎
ZM203S2027_025,耳子脣接落聽著阿春依熟事个聲音
ZM203S2027_026,電火慢慢燈係在𠊎个面前係阿怙
ZM203S2027_027,係講討暗啊日頭尖尖落山阿女仰子猶吂轉咧
ZM203S2027_028,阿怙著急和飯嘛無食擎手電出來車頭接佢个滿女
ZM203S2027_029,䀴著阿怙个時含蹛个目汁炙著目珠路嘛䀴毋會著
ZM203S2027_030,𠊎真感心細細聲講阿怙勞力
ZM213P2101_001,佢起性地啊
ZM213P2101_002,恁久無䀴著
ZM213P2101_003,𠊎轉來啊
ZM213P2101_004,你跍到哪位
ZM213P2101_005,真得人惜
ZM213P2101_006,真得人慼哦
ZM213P2101_007,阿依猶吂轉來
ZM213P2101_008,有閒攔來尞
ZM213P2101_009,你夫娘真靚
ZM213P2101_010,拁電火關莫
ZM213P2101_011,駛車愛細義
ZM213P2101_012,坐飛機較緊
ZM213P2101_013,寒著愛戴嘴揞
ZM213P2101_014,你哪位無堵好
ZM213P2101_015,實在足難相信
ZM213P2101_016,勞力你个照顧
ZM213P2101_017,上課毋好啄睡
ZM213P2101_018,今日天氣真好
ZM213P2101_019,昨日無閒歸日
ZM213P2101_020,歹勢無要緊
ZM213P2101_021,得𠊎想起
ZM213P2101_022,有人在屋下無
ZM213P2101_023,阿怙無在屋下
ZM213P2101_024,厥丈夫真緣投
ZM213P2101_025,歹勢攪吵啊
ZM213P2101_026,你愛攔時間無
ZM213P2101_027,有麼个問題無
ZM213P2101_028,你想到真周到
ZM213P2101_029,這站無閒麼个
ZM213P2101_030,你傷慢到位啊
ZM213P2101_031,𠢕愛睡當晝
ZM213P2101_032,請在這斡倒裡
ZM213P2101_033,五月節愛食餡粽
ZM213P2101_034,你个手機腳號
ZM213P2101_035,你个功課做好吂
ZM213P2101_036,𠊎會細義兜
ZM213P2101_037,這個想法真正好
ZM213P2101_038,會用無毋會用
ZM213P2101_039,你會無無問題
ZM213P2101_040,𠊎真愛食青菜
ZM213P2101_041,你愛啉麼个飲料
ZM213P2101_042,這雙鞋無幾合腳
ZM213P2101_043,臺灣不時有地動
ZM213P2101_044,這位毋會用食薰
ZM213P2101_045,天氣變到真涼爽
ZM213P2101_046,韶日晨早正聯絡
ZM213P2101_047,請問愛麼个服務
ZM213P2101_048,勞力毋使細義
ZM213P2101_049,𠢕早食飽吂
ZM213P2101_050,阿公在間底歇睏
ZM213P2101_051,阿依在灶下煮飯
ZM213P2101_052,請問哪位有便所
ZM213P2101_053,有失眠个問題無
ZM213P2101_054,祝福你量早康復
ZM213P2101_055,算較便宜兜好無
ZM213P2101_056,𠊎想討學做麵包
ZM213P2101_057,這個皮包係麼儕个
ZM213P2101_058,阿妹背書包去學校
ZM213P2101_059,阿姊真愛食菜頭粄
ZM213P2101_060,寒天北部不時落雨
ZM213P2101_061,毋好為著這來失志
ZM213P2101_062,係麼儕打來个電話
ZM213P2101_063,垃圾愛做資源回收
ZM213P2101_064,今日討舅㜷仰子
ZM213P2101_065,𠊎昨暗夜失眠啊
ZM213P2101_066,佢愛照顧佢个阿依
ZM213P2101_067,麻煩你開電火好無
ZM213P2101_068,恁暗啊好去睡啊
ZM213P2101_069,阿弟在廳下䀴電視
ZM213P2101_070,𠊎逐晨早掃泥下
ZM213P2101_071,入來屋下底愛脫鞋
ZM213P2101_072,坐火車愛先打車票
ZM213P2101_073,老儕坐巴士毋使錢
ZM213P2101_074,你按算在這打幾久
ZM213P2101_075,請問愛仰子強提票咧
ZM213P2101_076,請問收銀臺在哪位
ZM213P2101_077,𠊎討加一頂眠床
ZM213P2101_078,請問你哪位無快活
ZM213P2101_079,你這個症頭幾久啊
ZM213P2101_080,𠊎開食个料得你
ZM213P2101_081,請問內科愛仰子行
ZM213P2101_082,阿叔毋會慣勢著西裝
ZM213P2101_083,慢慢子行毋使攔緊
ZM213P2101_084,恭喜發財新年快樂
ZM213P2101_085,請毋好在車底食物件
ZM213P2101_086,學生愛著制服去學校
ZM213P2101_087,阿伯蹛个樓屋有電梯
ZM213P2101_088,𠊎行去郵便局寄批
ZM213P2101_089,𠊎在十字路口等你
ZM213P2101_090,佢這擺用信用卡納錢
ZM213P2101_091,佢在網路買物件真利便
ZM213P2101_092,佢著新褲去外媽屋下
ZM213P2101_093,恁吵你仰子拄會核
ZM213P2101_094,今日个報紙你有䀴吂
ZM213P2101_095,共下來去公園運動啊
ZM213P2101_096,𠊎無閒到無閒挾掣
ZM213P2101_097,請問高鐵車頭仰子行
ZM213P2101_098,𠊎尿急想討屙尿
ZM213P2101_099,阿妹在洗浴間洗膴身
ZM213P2101_100,𠊎逐日騎鐵馬上班
ZM213P2101_101,上禮拜一歸日落雨
ZM213P2101_102,桌崠有六支燒水罐
ZM213P2101_103,紙箱內底有兩粒球
ZM213P2101_104,請問你識來過雲林無
ZM213P2101_105,猶幾久擱九分鐘
ZM213P2101_106,這本書攏總有五百頁
ZM213P2101_107,這領衫𠊎開五百箍
ZM213P2101_108,佢蹛哪位佢蹛新竹市
ZM213P2101_109,請問中壢火車站仰子去
ZM213P2101_110,後禮拜五愛記得交作業
ZM213P2101_111,這滿幾多點啊十二點
ZM213P2101_112,佢在路上撿著七十六箍
ZM213P2101_113,𠊎屋下攏總有六個人
ZM213P2101_114,阿松哥四月初八討渡夫娘
ZM213P2101_115,後禮拜二愛考試你知無
ZM213P2101_116,你韶日幾多點討來五點
ZM213P2101_117,這西瓜幾多錢七十四箍
ZM213P2101_118,佢這擺買火車票開七百箍
ZM213P2101_119,請問這個禮拜六有空个房間無
ZM213P2101_120,韶日𠊎討坐頭枋車去鳳山
ZM213P2101_121,𠊎逐日一點愛䀴電視新聞
ZM213P2101_122,𠊎算一下攏總愛六百箍
ZM213P2101_123,你幾多歲啊𠊎今年四歲
ZM213P2101_124,超過六點啊吂到位即算慢到啊
ZM213P2101_125,三十八路公車來啊較緊上車
ZM213P2101_126,佢正考著十六分爺哀真失望
ZM213P2101_127,請問你幾多號𠊎係八十號
ZM213P2101_128,這個幾多錢這個兩千八百箍
ZM213P2101_129,請問你對哪位來𠊎對臺北來
ZM213P2101_130,𠊎爸準備討去花蓮出差個半月
ZM213P2101_131,請問𠊎討去到高雄愛仰子盤車
ZM213P2101_132,一斤正九十七箍定價數真實在
ZM213P2101_133,對這行路去火車頭愛行八分鐘
ZM213P2101_134,伸這兜歸下賣點三百箍即好
ZM213P2101_135,𠊎今日慢到四分鐘得先生罵
ZM213P2101_136,做捷運毋會用食物件
ZM213P2101_137,寒天著膨線衫真燒暖
ZM213P2101_138,請問遊客中心在哪位
ZM213P2101_139,請問愛去哪位領行李
ZM213P2101_140,請問係跳會算錢喊个
ZM213P2101_141,請在下一個路口歇車
ZM213P2101_142,這係鐵卡當必係毋係
ZM213P2101_143,會用轉較便宜兜無
ZM213P2101_144,請問猶有免稅服務無
ZM213P2101_145,𠊎正討喊客房服務
ZM213P2101_146,請問你討辦麼個手續
ZM213P2101_147,結婚證人愛萬二十歲
ZM213P2101_148,今日有哪位無快活無
ZM213P2101_149,請問你仰子著傷个
ZM213P2101_150,請問討入位繳日咧
ZM213P2101_151,普通時有食麼个藥無
ZM213P2101_152,請問愛幾久換一擺藥
ZM213P2101_153,請問掛號櫃臺在哪位
ZM213P2101_154,請問你个聯絡電話个
ZM213P2101_155,大花作垺來去打鬥四
ZM213P2101_156,新个頭路你做會慣勢無
ZM213P2101_157,今日歇睏毋使去學校
ZM213P2101_158,你識佢無𠊎毋識佢
ZM213P2101_159,阿怙仔逐晨早都愛啉咖啡
ZM213P2101_160,請問這領衫係麼个寸尺
ZM213P2101_161,佢人逐暗夜攏愛補習
ZM213P2101_162,熱天大家拁阿怙海脣尞
ZM213P2101_163,有病愛較緊去得先生䀴
ZM213P2101_164,表大逐日攏真認真做事
ZM213P2101_165,暗夜時駛車愛擱較注意
ZM213P2101_166,請問會用尋麼儕鬥相共
ZM213P2101_167,韶日會用在屋下打電動
ZM213P2101_168,較緊个討赴毋會著啊
ZM213P2101_169,有人客來毋好打赤膊
ZM213P2101_170,請問哪位有換錢个服務
ZM213P2101_171,請問就近哪位有加油站
ZM213P2101_172,請擱拁𠊎加一兜水
ZM213P2101_173,𠊎討擱點一份隨轉去
ZM213P2101_174,𠊎會用試著這領衫無
ZM213P2101_175,這領褲猶有別種色地無
ZM213P2101_176,𠊎會用𠊎換別款寸尺無
ZM213P2101_177,機制刻行樓梯在哪位
ZM213P2101_178,請坐𠊎拁你磅血壓
ZM213P2101_179,請問你有指定个醫生無
ZM213P2101_180,你好𠊎討預約掛號
ZM213P2101_181,你現時有在食麼个藥無
ZM213P2101_182,你好𠊎有預約挷牙
ZM213P2101_183,𠊎拁你安排回診時間
ZM213P2101_184,請問補助款幾時會撥落來
ZM213P2101_185,你真慶哦哪有無影啦
ZM213P2101_186,𠊎人輒輒作垺合買美食
ZM213P2101_187,即毋會用食啊生菇个物件即毋會用人食啊
ZM213P2101_188,有條路較近較條路較遠
ZM213P2101_189,啉酒莫駛車駛車莫啉酒
ZM213P2101_190,請等一下𠊎黏時過來
ZM213P2101_191,請問自由座愛在哪位排列
ZM213P2101_192,請載𠊎去頭近个捷運站
ZM213P2101_193,𠊎會用蹛到坪頭遐桌無
ZM213P2101_194,𠊎會用用真用卡納錢無
ZM213P2101_195,𠊎用額溫槍拁你量體溫
ZM213P2101_196,請問你想討掛哪科个門診
ZM213P2101_197,你有對食物抑藥物過敏無
ZM213P2101_198,𠊎這嘛討拁你檢查一下
ZM213P2101_199,你現時頭疾个所在係哪位
ZM213P2101_200,你愛兩儕抑係單儕个病房
ZM213P2101_201,𠊎註註三月初一一暗个三人房
ZM213P2101_202,頭節斡正手裡即到位澎湖縣政府啊
ZM213P2101_203,佢拁人去基隆打拚厥依真擘心
ZM213P2101_204,今日十點愛開會哦請鬥準備資料
ZM213P2101_205,你等下有閒無九點作垺來去運動
ZM213P2101_206,佢在晡三點䀴電視佢划飯划真緊
ZM213P2101_207,請問恁有座位無𠊎討買一張全票
ZM213P2101_208,阿哥後日討坐四點火車去竹南出差
ZM213P2101_209,請問到位嘉義愛駛幾久愛駛四點鐘
ZM213P2101_210,王先生你掛个四月初三晨早个門診
ZM213P2101_212,你討辦个業務在九樓𠊎拁你擪電梯
ZM213P2101_213,你後生今年幾多歲𠊎後生今年七歲
ZM213P2101_214,到位苗栗大約猶有幾多公里猶有兩公里
ZM213P2101_215,十月二十學校放假遐日來去䀴電影好無
ZM213P2101_216,歹勢啦請你韶日兩點正擱打電話來掛號
ZM213P2101_217,一百空四年度客語認證正式開始報名
ZM213P2101_218,三頓食飽後愛食藥一日食三擺一擺八粒
ZM213P2101_219,𠊎人有八個人𠊎人想討坐偎窗門个位
ZM213P2101_220,會議地點在哪位會議地點在臺中市潭子區
ZM213P2101_221,小姐先生𠊎討點菜𠊎討點二號餐
ZM213P2101_222,你掛个八十六號愛先拁你收掛號費兩百箍
ZM213P2101_223,𠊎聽講阿美著著七千萬个大獎有影抑無影
ZM213P2101_224,若係討掛號麻煩健保卡得𠊎猶擱繳兩百箍
ZM213P2101_225,今年客家桐花祭對四月十二開始到五月初一為止
ZM213P2101_226,你韶日討坐幾多點个火車𠊎討坐十一點个火車
ZM213P2101_227,佢請假五日得頭家扣月俸
ZM213P2101_228,拜二佢請假你代理一下好無
ZM213P2101_229,佢去踅百貨公司鑪卡買物件開六萬箍
ZM213P2101_230,阿爸討去申請護照
ZM213P2101_231,起眼人愛戴安全帽
ZM213P2101_232,請問𠊎愛去哪位做體檢
ZM213P2101_233,請問你貴姓喊做麼个名
ZM213P2101_234,請問討仰子加入公所健保
ZM213P2101_235,天氣輒變愛著遐燒暖一兜
ZM213P2101_236,便利商店會用買著真多物件
ZM213P2101_237,𠊎當在講電話請等一下
ZM213P2101_238,𠊎準備好啊會用開始啊
ZM213P2101_239,這件事情得你講到恁輕可
ZM213P2101_240,喊計程車毋使擘心歇車問題
ZM213P2101_241,請問哪跡位有𢳪行李个推車
ZM213P2101_242,車站內底有行李置物櫃服務
ZM213P2101_243,請問𠊎个大型行李愛囥在哪位
ZM213P2101_244,請問這頭近个捷運站在哪位
ZM213P2101_245,這兜得人餐業个餐點係麼个
ZM213P2101_246,𠊎人會用𠊎點餐啊麻煩你
ZM213P2101_247,請問房間價數有百貨公司早頓無
ZM213P2101_248,這下隨請急診醫生拁你䀴診
ZM213P2101_249,你好𠊎會用去這問路無
ZM213P2101_250,後次擺正擱約時間共下坐坐个
ZM213P2101_251,當晝頭恁誠熱毋好出去運動
ZM213P2101_252,客人用覆菜做等路真受歡迎
ZM213P2101_253,阿公有糖尿病毋會用食傷甜
ZM213P2101_254,請問貴姓𠊎姓黃名大民
ZM213P2101_255,熱天真熱著短衫袖就會落雨
ZM213P2101_256,會用請你拁𠊎人翕一張相無
ZM213P2101_257,請問這就近个公車站牌在哪位
ZM213P2101_258,請問這班車有到位苗栗車頭無
ZM213P2101_259,落車時請注意後背个來車
ZM213P2101_260,請問這就近猶有哪兜觀光景點
ZM213P2101_261,這係找你个錢這係你个白票
ZM213P2101_262,𠊎想討愛一間視線好个房間
ZM213P2101_263,請問𠊎會用來這借輪椅用無
ZM213P2101_264,這係病院个門診表請你參考
ZM213P2101_265,生日快樂身體康健萬事如意
ZM213P2101_266,客家文化園區輒輒舉辦展覽活動
ZM213P2101_267,你好請問有麼个愛鬥相共个無
ZM213P2101_268,請問有飯店去到機場个接駁車無
ZM213P2101_269,你記得上擺做健康檢查个時間無
ZM213P2101_270,𠊎討討市民委會公車个時刻表
ZM213P2101_271,毋好直直䀴電視目珠會䀴壞去
ZM213P2101_272,好跋起來較緊去洗面洗牙
ZM213P2101_273,你今日著恁派頭到去食酒係無
ZM213P2101_274,你會用先上臺鐵網站查詢火車時刻
ZM213P2101_275,請問落南个高鐵愛在哪個月臺上車
ZM213P2101_276,飯店个房間內底有提供免費網路無
ZM213P2101_277,你體溫个攝氏三十六度半正常
ZM213P2101_278,你有隨健保卡無𠊎先拁你掛號
ZM213P2101_279,請問你有來過𠊎人病院䀴診過無
ZM213P2101_280,請問想討在路脣排擔愛仰子申請
ZM213P2101_281,請問討坐个一班車在第九月台上車
ZM213P2101_282,請問𠊎愛上車囥車啊係落車正囥錢
ZM213P2101_283,附餐這哪兜啉个和甜點請拁𠊎紹介
ZM213P2101_284,醫生𠊎若像食壞食肚啊真艱難
ZM213P2101_285,這站不時咳嗽流濞可能係寒著啊
ZM213P2101_286,請問你討訂病院个伙食無有食菜無
ZM213P2101_287,請問𠊎愛隨麼个證件來辦老人年金
ZM213P2101_288,請問入蹛和退房間个時間係麼个時務个
ZM213P2101_289,足好个𠊎真佮意這雙鞋堵好有打折
ZM213P2101_290,𠊎房間个冷氣毋會涼會攏來䀴望下無
ZM213P2101_291,𠊎想討借囥行李請問會用借囥幾久
ZM213P2101_292,你好請坐請問有麼个會用拁你服務个無
ZM213P2101_293,𠊎屋下整理出一墩書請問會用捐去哪位
ZM213P2101_294,𠊎會拁你一兜到位請留𠊎註文个本件
ZM213P2101_295,𠊎屋下就近个路燈故障啊請派專人來修理
ZM213P2101_296,𠊎个錢包毋肯去啊請問頭近个警察局在哪位
ZM213P2101_297,你个血壓有較高一兜仔愛注意身體个變化哦
ZM213P2101_298,頭那疾真多日啊請拁𠊎檢查係哪位个問題
ZM213P2101_299,公車站牌在市政府正門出去斡正手裡即會䀴著啊
ZM213P2101_300,𠊎屋下就近有流浪狗會用請你人派人來處理無
ZM304P2022_001,五月節愛食餡粽
ZM304P2022_002,擐著愛戴嘴揞
ZM304P2022_003,你哪位毋堵好
ZM304P2022_004,你个手機腳好
ZM304P2022_005,你个功課做好吂
ZM304P2022_006,𠊎會細義一兜
ZM304P2022_007,真歡喜識你
ZM304P2022_008,實在足難相信
ZM304P2022_009,這個想法真誠好
ZM304P2022_010,勞力你个照顧
ZM304P2022_011,會用無毋會用
ZM304P2022_012,你會無無問題
ZM304P2022_013,𠊎真愛食青菜
ZM304P2022_014,𠊎想討學做麵包
ZM304P2022_015,你愛啉麼个飲料
ZM304P2022_016,阿叔毋會慣勢著西裝
ZM304P2022_017,這個皮包係麼儕个
ZM304P2022_018,這雙鞋無幾合腳
ZM304P2022_019,臺灣不時有地動
ZM304P2022_020,這位个民宿真靚
ZM304P2022_021,這位毋會用食薰
ZM304P2022_022,上課毋好啄睡
ZM304P2022_023,今日天氣真好
ZM304P2022_024,昨日無閒歸日
ZM304P2022_025,天氣變到真涼爽
ZM304P2022_026,韶日晨早正聯絡
ZM304P2022_027,阿妹背書包去學校
ZM304P2022_028,阿姊真愛食菜頭粄
ZM304P2022_029,阿爸討去申請護照
ZM304P2022_030,慢慢子行毋使攔緊
ZM304P2022_031,寒天北部不時落雨
ZM304P2022_032,毋好為著這來失志
ZM304P2022_033,係麼儕打來个電話
ZM304P2022_034,垃圾愛做資源回收
ZM304P2022_035,請問愛麼个服務
ZM304P2022_036,恭喜發財新年快樂
ZM304P2022_037,𠊎愛你佢起性地啊
ZM304P2022_038,今日个菜口味仰子
ZM304P2022_039,請毋好在車底食物件
ZM304P2022_040,學生愛著制服去學校
ZM304P2022_041,阿伯蹛樓屋有電梯
ZM304P2022_042,𠊎行去郵便局寄批
ZM304P2022_043,𠊎在十字路口等你
ZM304P2022_044,歸禮拜用信用卡納錢
ZM304P2022_045,阿弟通過認證考試啊
ZM304P2022_046,在網路買物件真利便
ZM304P2022_047,成个頭路你做會慣勢無
ZM304P2022_048,今日歇睏毋使去學校
ZM304P2022_049,歇睏一下恁久無䀴著
ZM304P2022_050,勞力毋使細義失禮
ZM304P2022_051,歹勢無要緊拜託你
ZM304P2022_052,你識佢無𠊎毋識佢
ZM304P2022_053,𠊎真悿𠊎真暢
ZM304P2022_054,阿怙逐晨早都愛啉咖啡
ZM304P2022_055,佢著新褲去外媽屋下
ZM304P2022_056,請問這領衫係麼个寸尺
ZM304P2022_057,恁吵你仰子拄會核
ZM304P2022_058,佢人逐暗夜攏愛去補習
ZM304P2022_059,熱天大家較愛去海脣尞
